{
  "$schema": "https://json-schema.org/draft/2020-12/schema",
  "$id": "urn:axiom:cli:install-result:linux:1",
  "title": "install-result (linux profile)",
  "description": "Linux platform profile of the axiom-cli `install-result` envelope emitted by the per-user installer on `linux-x64` (including a WSL2 run, which the distribution contract section 8 rule 3 records as linux-x64 evidence and never as Windows evidence). The shared envelope and its canonical Windows profile are owned by `packaging/install-result.schema.json`; this file MUST NOT diverge from it in the 33 top-level keys. Only the platform-valued blocks (`platform`, `host`, `path_rule`, `service_registration`, `removed[].kind`) are narrowed here, because those blocks are platform-specific by design: Linux has no registry and its user service manager is `systemd --user`, not a scheduled task. The ecosystem integration step is expected to widen the shared schema's `platform` enum and host block rather than keep two competing envelopes.",
  "type": "object",
  "additionalProperties": false,
  "required": [
    "schema_version",
    "spec_version",
    "envelope_kind",
    "operation",
    "outcome",
    "exit_code",
    "status",
    "message",
    "retryable",
    "platform",
    "host",
    "install_root",
    "bin_dir",
    "dry_run",
    "mutated",
    "plan_digest",
    "approved_digest",
    "transaction_id",
    "interrupted_install_recovered",
    "release_set",
    "artifacts",
    "unverified_artifacts",
    "components",
    "refusals",
    "path_rule",
    "service_registration",
    "preserved",
    "removed",
    "elevation_required",
    "shell",
    "limitations",
    "generated_at",
    "request_id"
  ],
  "properties": {
    "schema_version": { "const": 1 },
    "spec_version": { "type": "string", "minLength": 1 },
    "envelope_kind": { "const": "install-result" },
    "operation": { "enum": ["install", "uninstall"] },
    "outcome": {
      "enum": [
        "planned",
        "installed",
        "already_installed",
        "recovered_and_installed",
        "refused",
        "rolled_back",
        "removed",
        "not_removed"
      ]
    },
    "exit_code": { "type": "integer", "minimum": 0 },
    "status": { "enum": ["ok", "refused", "error"] },
    "message": { "type": "string" },
    "retryable": { "type": "boolean" },
    "platform": { "const": "linux-x64" },
    "host": {
      "type": "object",
      "additionalProperties": false,
      "required": [
        "os",
        "arch",
        "kernel",
        "distro_id",
        "distro_version",
        "libc",
        "wsl",
        "wsl_distro_name",
        "session_uid",
        "session_elevated",
        "systemd_user_available"
      ],
      "properties": {
        "os": { "const": "linux" },
        "arch": { "enum": ["x86_64"] },
        "kernel": { "type": "string", "minLength": 1 },
        "distro_id": { "type": "string", "minLength": 1 },
        "distro_version": { "type": "string", "minLength": 1 },
        "libc": { "type": "string", "minLength": 1 },
        "wsl": { "type": "boolean" },
        "wsl_distro_name": { "type": ["string", "null"] },
        "session_uid": { "type": "integer", "minimum": 0 },
        "session_elevated": { "type": "boolean" },
        "systemd_user_available": { "type": "boolean" }
      }
    },
    "install_root": { "type": ["string", "null"] },
    "bin_dir": { "type": ["string", "null"] },
    "dry_run": { "type": "boolean" },
    "mutated": { "type": "boolean" },
    "plan_digest": { "type": ["string", "null"], "pattern": "^([0-9a-f]{64})?$" },
    "approved_digest": { "type": ["string", "null"], "pattern": "^([0-9a-f]{64})?$" },
    "transaction_id": { "type": ["string", "null"] },
    "interrupted_install_recovered": { "type": "boolean" },
    "release_set": {
      "type": ["object", "null"],
      "additionalProperties": false,
      "required": ["path", "sha256", "release_version"],
      "properties": {
        "path": { "type": "string" },
        "sha256": { "type": "string", "pattern": "^[0-9a-f]{64}$" },
        "release_version": { "type": "string", "minLength": 1 }
      }
    },
    "artifacts": {
      "type": "array",
      "items": {
        "type": "object",
        "additionalProperties": false,
        "required": [
          "name",
          "component",
          "version",
          "arch",
          "sha256",
          "size_bytes",
          "verified",
          "installed_path",
          "source"
        ],
        "properties": {
          "name": { "type": "string", "minLength": 1 },
          "component": { "type": "string", "minLength": 1 },
          "version": { "type": "string", "minLength": 1 },
          "arch": { "type": "string", "minLength": 1 },
          "sha256": { "type": "string", "pattern": "^[0-9a-f]{64}$" },
          "size_bytes": { "type": "integer", "minimum": 0 },
          "verified": { "const": true },
          "installed_path": { "type": ["string", "null"] },
          "source": { "type": "string", "minLength": 1 }
        }
      }
    },
    "unverified_artifacts": {
      "type": "array",
      "items": {
        "type": "object",
        "additionalProperties": false,
        "required": ["name", "component", "reason"],
        "properties": {
          "name": { "type": "string", "minLength": 1 },
          "component": { "type": "string", "minLength": 1 },
          "reason": { "type": "string", "minLength": 1 }
        }
      }
    },
    "components": {
      "type": "array",
      "items": {
        "type": "object",
        "additionalProperties": false,
        "required": ["component", "installed_version", "artifact_sha256", "version_source"],
        "properties": {
          "component": { "type": "string", "minLength": 1 },
          "installed_version": { "type": ["string", "null"] },
          "artifact_sha256": { "type": ["string", "null"] },
          "version_source": { "type": "string", "minLength": 1 }
        }
      }
    },
    "refusals": {
      "type": "array",
      "items": {
        "type": "object",
        "additionalProperties": false,
        "required": ["check", "artifact", "expected_sha256", "actual_sha256", "reason"],
        "properties": {
          "check": { "type": "string", "minLength": 1 },
          "artifact": { "type": "string", "minLength": 1 },
          "expected_sha256": { "type": ["string", "null"] },
          "actual_sha256": { "type": ["string", "null"] },
          "reason": { "type": "string", "minLength": 1 }
        }
      }
    },
    "path_rule": {
      "type": "object",
      "additionalProperties": false,
      "required": [
        "scope",
        "file",
        "entry",
        "applied",
        "machine_wide_change",
        "previous_present"
      ],
      "properties": {
        "scope": { "enum": ["user", "none"] },
        "file": { "type": ["string", "null"] },
        "entry": { "type": "string" },
        "applied": { "type": "boolean" },
        "machine_wide_change": { "const": false },
        "previous_present": { "type": "boolean" }
      }
    },
    "service_registration": {
      "type": "object",
      "additionalProperties": false,
      "required": [
        "kind",
        "unit_name",
        "unit_path",
        "owner",
        "registered",
        "removed",
        "daemon_reloaded",
        "reason"
      ],
      "properties": {
        "kind": { "enum": ["none", "systemd-user"] },
        "unit_name": { "type": ["string", "null"] },
        "unit_path": { "type": ["string", "null"] },
        "owner": { "type": ["string", "null"] },
        "registered": { "type": "boolean" },
        "removed": { "type": "boolean" },
        "daemon_reloaded": { "type": "boolean" },
        "reason": { "type": "string", "minLength": 1 }
      }
    },
    "preserved": {
      "type": "array",
      "items": {
        "type": "object",
        "additionalProperties": false,
        "required": ["path", "reason"],
        "properties": {
          "path": { "type": "string" },
          "reason": { "type": "string", "minLength": 1 }
        }
      }
    },
    "removed": {
      "type": "array",
      "items": {
        "type": "object",
        "additionalProperties": false,
        "required": ["path", "kind"],
        "properties": {
          "path": { "type": "string" },
          "kind": {
            "enum": [
              "executable",
              "generation",
              "path-entry",
              "service-registration",
              "staging",
              "state-directory",
              "install-root",
              "owner-marker"
            ]
          }
        }
      }
    },
    "elevation_required": { "const": false },
    "shell": { "const": "linux-posix-sh" },
    "limitations": {
      "type": "array",
      "items": { "type": "string", "minLength": 1 }
    },
    "generated_at": {
      "type": "string",
      "pattern": "^\\d{4}-\\d{2}-\\d{2}T\\d{2}:\\d{2}:\\d{2}Z$"
    },
    "request_id": { "type": "string", "minLength": 1 }
  }
}
