{"schema_version":1,"spec_version":"2.0.0-draft.1","envelope_kind":"install-result","operation":"uninstall","outcome":"planned","exit_code":0,"status":"ok","message":"uninstall plan computed; nothing was removed","retryable":false,"platform":"linux-x64","host":{"os":"linux","arch":"x86_64","kernel":"Linux 6.12.76-linuxkit x86_64 GNU/Linux","distro_id":"debian","distro_version":"12","libc":"glibc 2.36","wsl":false,"wsl_distro_name":null,"session_uid":10001,"session_elevated":false,"systemd_user_available":false},"install_root":"/home/axiom/.local/share/axiom-cli","bin_dir":"/home/axiom/.local/bin","dry_run":true,"mutated":false,"plan_digest":"235372506185ecc144711e37c63bedbfcdde7d38ba73b319880c9e1c4d7f8cc5","approved_digest":null,"transaction_id":null,"interrupted_install_recovered":false,"release_set":null,"artifacts":[],"unverified_artifacts":[],"components":[],"refusals":[],"path_rule":{"scope":"none","file":null,"entry":"/home/axiom/.local/bin","applied":false,"machine_wide_change":false,"previous_present":false},"service_registration":{"kind":"none","unit_name":null,"unit_path":null,"owner":null,"registered":false,"removed":false,"daemon_reloaded":false,"reason":"no service registration is recorded by this envelope"},"preserved":[{"path":"/home/axiom/.local/state/axiom-cli","reason":"per-user state is preserved by uninstall; only --purge with an approved digest deletes it"}],"removed":[],"elevation_required":false,"shell":"linux-posix-sh","limitations":[],"generated_at":"2026-09-29T15:51:27Z","request_id":"axiom-cli-7-1790697087"}
