{"schema_version":1,"spec_version":"2.0.0-draft.1","envelope_kind":"install-result","operation":"install","outcome":"installed","exit_code":0,"status":"ok","message":"installed release 0.1.0 into /home/axiom/.local/share/axiom-cli/generations/0.1.0-6a0a98edf256; entrypoint at /home/axiom/.local/bin/axiom-cli","retryable":false,"platform":"linux-x64","host":{"os":"linux","arch":"x86_64","kernel":"Linux 6.12.76-linuxkit x86_64 GNU/Linux","distro_id":"debian","distro_version":"12","libc":"glibc 2.36","wsl":false,"wsl_distro_name":null,"session_uid":10001,"session_elevated":false,"systemd_user_available":false},"install_root":"/home/axiom/.local/share/axiom-cli","bin_dir":"/home/axiom/.local/bin","dry_run":false,"mutated":true,"plan_digest":"6a0a98edf256eedcc3f6857fcd7da7282953276c70745de54f895e363ee65418","approved_digest":"6a0a98edf256eedcc3f6857fcd7da7282953276c70745de54f895e363ee65418","transaction_id":"txn-1790690792-423","interrupted_install_recovered":false,"release_set":{"path":"/tmp/axiom-cli-release/release-set.json","sha256":"6bc74285305281ebdcf1402c51647f380df47e6589189fdc291219a3acb26196","release_version":"0.1.0"},"artifacts":[{"name":"axiom-cli","component":"axiom-cli","version":"0.1.0","arch":"x86_64","sha256":"02d7c19861f5ef21b5a329298ca6c6080c8922f5cdca8e4cb2d86c4e3430dd6b","size_bytes":1194392,"verified":true,"installed_path":"/home/axiom/.local/share/axiom-cli/generations/0.1.0-6a0a98edf256/axiom-cli","source":"axiom-cli"}],"unverified_artifacts":[{"name":"axiom-graphd","component":"axiom-graphd","reason":"the distribution contract requires this component in a complete installation, but this release set carries no pinned artifact for it, so it was not installed and nothing about its state is claimed"},{"name":"axiom-mcp","component":"axiom-mcp","reason":"the distribution contract requires this component in a complete installation, but this release set carries no pinned artifact for it, so it was not installed and nothing about its state is claimed"},{"name":"skills","component":"skills","reason":"the distribution contract requires this component in a complete installation, but this release set carries no pinned artifact for it, so it was not installed and nothing about its state is claimed"}],"components":[{"component":"axiom-cli","installed_version":"0.1.0","artifact_sha256":"02d7c19861f5ef21b5a329298ca6c6080c8922f5cdca8e4cb2d86c4e3430dd6b","version_source":"release-set.json (declared by this release set)"}],"refusals":[],"path_rule":{"scope":"none","file":null,"entry":"/home/axiom/.local/bin","applied":false,"machine_wide_change":false,"previous_present":false},"service_registration":{"kind":"none","unit_name":null,"unit_path":null,"owner":null,"registered":false,"removed":false,"daemon_reloaded":false,"reason":"service registration was disabled by --service none"},"preserved":[{"path":"/home/axiom/.local/state/axiom-cli","reason":"per-user state is never modified by install and is preserved for uninstall"}],"removed":[],"elevation_required":false,"shell":"linux-posix-sh","limitations":["entrypoint directory /home/axiom/.local/bin is reported but never added to PATH by this installer (no hidden PATH mutation); add it yourself if it is not already on PATH"],"generated_at":"2026-09-29T14:06:32Z","request_id":"axiom-cli-423-1790690792"}
