{"schema_version":1,"spec_version":"2.0.0-draft.1","envelope_kind":"install-result","operation":"uninstall","outcome":"removed","exit_code":0,"status":"ok","message":"removed the axiom-cli installation owned by this installer from /home/axiom/.local/share/axiom-cli","retryable":false,"platform":"linux-x64","host":{"os":"linux","arch":"x86_64","kernel":"Linux 6.12.76-linuxkit x86_64 GNU/Linux","distro_id":"debian","distro_version":"12","libc":"glibc 2.36","wsl":false,"wsl_distro_name":null,"session_uid":10001,"session_elevated":false,"systemd_user_available":false},"install_root":"/home/axiom/.local/share/axiom-cli","bin_dir":"/home/axiom/.local/bin","dry_run":false,"mutated":true,"plan_digest":"235372506185ecc144711e37c63bedbfcdde7d38ba73b319880c9e1c4d7f8cc5","approved_digest":"235372506185ecc144711e37c63bedbfcdde7d38ba73b319880c9e1c4d7f8cc5","transaction_id":"txn-1790690984-166","interrupted_install_recovered":false,"release_set":null,"artifacts":[],"unverified_artifacts":[],"components":[],"refusals":[],"path_rule":{"scope":"none","file":null,"entry":"/home/axiom/.local/bin","applied":false,"machine_wide_change":false,"previous_present":false},"service_registration":{"kind":"none","unit_name":null,"unit_path":null,"owner":null,"registered":false,"removed":false,"daemon_reloaded":false,"reason":"no service registration is recorded by this envelope"},"preserved":[{"path":"/home/axiom/.local/state/axiom-cli","reason":"per-user state is preserved by uninstall; only --purge with an approved digest deletes it"},{"path":"/home/axiom/.local/state/axiom-cli","reason":"per-user state is preserved because --purge was not requested"}],"removed":[{"path":"/home/axiom/.local/bin/axiom-cli","kind":"executable"},{"path":"/home/axiom/.local/share/axiom-cli/generations/0.1.0-6a0a98edf256","kind":"generation"},{"path":"/home/axiom/.local/share/axiom-cli/.axiom-cli-owner","kind":"owner-marker"}],"elevation_required":false,"shell":"linux-posix-sh","limitations":[],"generated_at":"2026-09-29T14:09:44Z","request_id":"axiom-cli-166-1790690984"}
